<!DOCTYPE books SYSTEM "books.dtd">
<books>
	<book>
		<id>100</id>
		<name>java</name>
		<author>james</author>
		<author>siera</author>
	</book>
	<book>
		<id>100</id>
		<name>xml</name>
		<author>jason</author>
		<prize>250</prize>
		<imported/>
	</book>
</books>
